{
  "schema_version": "proxy_risk_case.v1",
  "case_id": "ADV-003",
  "split": "adversarial",
  "scenario_name": "Repeated proxy changes without writer attribution",
  "expected_class": "REVERTER_SUSPECTED",
  "expected_min_tier": "T1",
  "expected_policy": "HUMAN_REVIEW",
  "provenance": "synthetic adversarial temporal fixture",
  "limitations": ["Repeated changes do not identify the registry writer."],
  "signals": {
    "proxy_state": {
      "timestamp_utc": "2026-08-03T00:02:00Z",
      "endpoint_id": "research-endpoint-203",
      "wininet_proxy_enabled": true,
      "wininet_proxy_server": "127.0.0.1:7890",
      "winhttp_direct_access": false,
      "localhost_port": 7890
    },
    "timeline": [
      {
        "timestamp_utc": "2026-08-03T00:02:01Z",
        "endpoint_id": "research-endpoint-203",
        "old_state": {"wininet_proxy_enabled": false, "wininet_proxy_server": ""},
        "new_state": {"wininet_proxy_enabled": true, "wininet_proxy_server": "127.0.0.1:7890"},
        "reverter_suspected": true,
        "reverter_diagnosis": {"status": "REVERTER_SUSPECTED"}
      }
    ]
  }
}
