{
  "schema_version": "proxy_risk_case.v1",
  "case_id": "DEV-001",
  "split": "development",
  "scenario_name": "Proxy disabled and direct path succeeds",
  "expected_class": "NO_PROXY_DIRECT_OK",
  "expected_min_tier": "T3",
  "expected_policy": "OBSERVE",
  "provenance": "deterministic synthetic fixture",
  "limitations": ["No production prevalence claim."],
  "signals": {
    "proxy_state": {
      "timestamp_utc": "2026-08-01T00:00:00Z",
      "endpoint_id": "research-endpoint-001",
      "wininet_proxy_enabled": false,
      "wininet_proxy_server": "",
      "winhttp_direct_access": true
    },
    "health_inject": {
      "timestamp_utc": "2026-08-01T00:00:01Z",
      "endpoint_id": "research-endpoint-001",
      "proxy_status": "DIRECT_ONLY_HEALTHY",
      "direct_probe_ok": true,
      "proxy_probe_ok": null
    }
  }
}
