{
  "schema_version": "proxy_risk_case.v1",
  "case_id": "DEV-002",
  "split": "development",
  "scenario_name": "Dead localhost proxy without listener",
  "expected_class": "DEAD_PROXY_CONFIG",
  "expected_min_tier": "T2",
  "expected_policy": "PREVIEW_ONLY",
  "provenance": "deterministic synthetic fixture",
  "limitations": ["Missing listener does not prove malicious activity."],
  "signals": {
    "proxy_state": {
      "timestamp_utc": "2026-08-01T00:01:00Z",
      "endpoint_id": "research-endpoint-002",
      "wininet_proxy_enabled": true,
      "wininet_proxy_server": "127.0.0.1:59081",
      "winhttp_direct_access": true,
      "localhost_port": 59081
    },
    "proxy_owner": {
      "timestamp_utc": "2026-08-01T00:01:01Z",
      "endpoint_id": "research-endpoint-002",
      "listener_found": false,
      "localhost_port": 59081
    }
  }
}
